{
  "archiveBytes": 72387192,
  "archiveName": "examples-1.0.4.zip",
  "archiveSHA256": "89bd11f2fa56a917d246a7bfa1ae3ac0836a91769cc6dfad90d9e12fb78e0a34",
  "contentVersion": "1.0.4",
  "courseDigest": "5ef704760287847b3324d668ea6fe8925ffb672215589bc8c0b31a4833429815",
  "courseID": "examples",
  "language": "en",
  "minimumAppVersion": "1.1",
  "requiredCapabilities": [
    "coursepack-v1",
    "examples-gallery-v1"
  ],
  "schemaVersion": 1
}
