{
  "archiveBytes": 3871076,
  "archiveName": "algorithms-1.0.1.zip",
  "archiveSHA256": "50877cc9eb94c9443d5690eb309361793ac5ad904640b2e98d96f07d922212fa",
  "contentVersion": "1.0.1",
  "courseDigest": "70b7922fc59056490633790414566424e4751489d1545daf6caa8938393dd214",
  "courseID": "algorithms",
  "language": "en",
  "minimumAppVersion": "1.1",
  "requiredCapabilities": [
    "coursepack-v1"
  ],
  "schemaVersion": 1
}
